week_number,year,question_order,is_hard,location_name,option_a,option_b,option_c,option_d,option_e,correct_option,explanation_text,location_lat,location_lng,location_zoom,wikipedia_urls,satellite_image,site_photo,status,location_name_fr,explanation_text_fr,option_a_fr,option_b_fr,option_c_fr,option_d_fr,option_e_fr,,
22,2026,3,true,Taal Volcano Philippines,Dam reservoir,Volcano inside a lake,Flooded mine,Freshwater lake,Digitally altered image,b,"Concentric rings of water and land forming a bull's-eye — a volcanic island inside a crater lake, itself inside a larger ancient caldera. Taal in the Philippines is one of the world's most active volcanoes, last erupting in 2020.",15.1385,120.3560,13,https://en.wikipedia.org/wiki/Taal_Volcano,PHI_Volcan_15.138539_120.355951.jpeg,,,"Volcan Taal, Philippines","Des anneaux concentriques d'eau et de terre formant une cible — une île volcanique dans un lac de cratère, lui-même dans une ancienne caldeira. Le Taal aux Philippines est l'un des volcans les plus actifs au monde, en éruption pour la dernière fois en 2020.",Réservoir de barrage,Volcan dans un lac,Mine inondée,Lac naturel,Image numériquement modifiée,,
23,2026,1,false,Wastewater Treatment Plant Sinai Egypt,Car park,Landfill,Wastewater treatment plant,Shrimp farm,Shopping centre construction,c,The long rectangular rows are electrolysis cells where aluminium is extracted from alumina. The port facility for importing raw materials and the dedicated power station nearby confirm this is one of the world's largest aluminium smelters.,27.9433,34.2984,16,https://en.wikipedia.org/wiki/Sewage_treatment,EGY_traitement_eau_usees_27.943274_34.298355.jpeg,,,"Station d'épuration des eaux usées, Sinaï, Égypte",Les longues rangées rectangulaires sont des cuves d'électrolyse où l'aluminium est extrait de l'alumine. L'installation portuaire pour l'importation des matières premières et la centrale électrique dédiée confirment que c'est l'une des plus grandes fonderies d'aluminium au monde.,Parking,Décharge,Station d'épuration des eaux usées,Élevage de crevettes,Centre commercial en construction,,
23,2026,2,false,Aluminium Smelter Bahrain,Aluminium smelter,Cement factory,Lime production plant,Copper smelter,Grain milling plant,a,The circular star-shaped earthworks are protective berms for missile launchers — each revetment allows the launcher to rotate and fire in any direction. This Cold War Soviet design is instantly recognisable from above.,26.0913,50.5966,14,https://en.wikipedia.org/wiki/Aluminium_Bahrain,QTR_Aluminium_26.091257_50.596554.jpeg,,,Fonderie d'aluminium de Bahreïn,Les terrassements circulaires en forme d'étoile sont des épaulements de protection pour des lanceurs de missiles — chaque revetment permet au lanceur de pivoter et de tirer dans toutes les directions. Ce design soviétique de la Guerre froide est immédiatement reconnaissable depuis le ciel.,Fonderie d'aluminium,Cimenterie,Usine de production de chaux,Fonderie de cuivre,Minoterie,,
23,2026,3,true,LNG Storage Tanks Qatar,Grain silos,LNG storage tanks,Oil tanks,Water towers,Underground ammo bunkers,b,The enormous circular tanks store liquefied natural gas at -162°C. Their perfect round shape and large diameter — up to 80 metres — make them instantly recognisable. Qatar is the world's largest LNG exporter.,25.9015,51.5788,14,https://en.wikipedia.org/wiki/North_Field_(gas_field),QTR_gaz_25.901459_51.578785.jpeg,,,Réservoirs de GNL du Qatar,Les énormes cuves circulaires stockent du gaz naturel liquéfié à -162°C. Leur forme ronde parfaite et leur grand diamètre — jusqu'à 80 mètres — les rendent instantanément reconnaissables. Le Qatar est le plus grand exportateur mondial de GNL.,Silos à céréales,Réservoirs de gaz naturel liquéfié,Cuves de pétrole,Châteaux d'eau,Bunkers de munitions souterrains,,
24,2026,1,false,Bahrain Solar-Shaded Car Park,Solar-shaded car park,Rooftop solar,Aircraft hangars,Desalination plant,Desert greenhouse tunnels,a,"The grid of metal frames looks exactly like solar panels from above — but these are shading canopies over car parks. In the Gulf sun exceeds 45°C; an unshaded car reaches 80°C inside. No solar cells, just shade.",26.2453,50.5865,18,https://en.wikipedia.org/wiki/Bahrain,BAH_parking_26_2453193_50_5864946.jpeg,,,Parking ombragé solaire de Bahreïn,"La grille de structures métalliques ressemble exactement à des panneaux solaires depuis le ciel — mais ce sont des auvents au-dessus de parkings. Dans le Golfe, le soleil dépasse 45°C ; une voiture non ombragée atteint 80°C à l'intérieur. Pas de cellules solaires, juste de l'ombre.",Parking ombragé solaire,Panneaux solaires,Hangars militaires,Usine de dessalement,Serres désertiques,,
24,2026,2,false,Bahrain Fuel Station,Petrol station,Toll plaza,Car wash,Drive-through restaurant,Bus depot inspection line,a,"The rectangular canopy shading the pumps, the wide forecourt and the long queue of cars are the clues. In Bahrain, petrol is so heavily subsidised it costs less than bottled water — hence the queues visible from space.",26.2240,50.5710,18,https://en.wikipedia.org/wiki/Bahrain,BAH_fuel-station_26_2239928_50_5710301.jpeg,,,Station-service de Bahreïn,"L'auvent rectangulaire au-dessus des pompes, le large parvis et la longue file de voitures sont les indices. À Bahreïn, l'essence est tellement subventionnée qu'elle coûte moins cher que l'eau en bouteille — d'où les files visibles depuis l'espace.",Station-service,Péage autoroutier,Station de lavage,Restaurant drive-in,Ligne d'inspection de bus,,
24,2026,3,true,Gas-Fired Power Plant Taiwan,Coastal gas power plant,Coastal hotel,Tech campus,Nuclear power plant,Shopping & entertainment mall,a,Large industrial buildings on the coast with tall exhaust stacks but no reactor domes — the key difference from a nuclear plant. The LNG tanks nearby confirm this is a gas-fired power station on Taiwan's coastline.,25.0275,121.0486,15,https://en.wikipedia.org/wiki/Energy_in_Taiwan,TWN_Usine_electrique_gaz_25.0274649_121.0486283.jpeg,,,Centrale électrique au gaz de Taïwan,De grands bâtiments industriels en bord de mer avec de hautes cheminées mais sans dômes de réacteurs — la différence clé avec une centrale nucléaire. Les réservoirs de GNL à proximité confirment qu'il s'agit d'une centrale au gaz sur la côte de Taïwan.,Centrale électrique au gaz côtière,Hôtel côtier,Campus technologique,Centrale nucléaire,Centre commercial et de divertissement,,
25,2026,1,false,Desalination Plant Bahrain,Oil refinery,Chemical plant,Sewage plant,Seawater desalination plant,Explosives factory,d,"Long parallel rows of reverse osmosis units, seawater intake channels and storage tanks — this is a desalination plant. Bahrain has no natural freshwater at all and was one of the first countries to desalinate seawater at scale.",26.2230,50.6620,15,https://en.wikipedia.org/wiki/Desalination_in_Bahrain,QTR_desalinesation_26.2229932_50.6619841.jpeg,,,Usine de dessalement de Bahreïn,"De longues rangées parallèles d'unités d'osmose inverse, des canaux d'entrée d'eau de mer et des réservoirs — c'est une usine de dessalement. Bahreïn n'a aucune eau douce naturelle et a été l'un des premiers pays à dessaler l'eau de mer à grande échelle.",Raffinerie,Usine chimique,Station d'épuration,Usine de dessalement,Usine d'explosifs,,
25,2026,2,false,Water Storage Tanks Bahrain,Grain silos,Crude oil tanks,Drinking water reservoirs,Gas tanks,Military ammo bunkers,c,The white domed tops and residential neighbourhood rule out oil or gas tanks. Water reservoirs in the Gulf are reinforced concrete cylinders with domed roofs — essential in a country entirely dependent on desalinated seawater.,26.2312,50.6634,16,https://en.wikipedia.org/wiki/Water_supply_and_sanitation_in_Bahrain,QTR_Stockage_eau_26.231181_50.663362.jpeg,,,Réservoirs d'eau potable de Bahreïn,Les dômes blancs et le contexte résidentiel excluent les cuves de pétrole ou de gaz. Les réservoirs d'eau dans le Golfe sont des cylindres en béton armé à toit en dôme — essentiels dans un pays entièrement dépendant de l'eau de mer dessalée.,Silos à céréales,Cuves de pétrole brut,Réservoirs d'eau potable,Réservoirs de gaz,Bunkers de munitions militaires,,
25,2026,3,true,Power Plant Bahrain,Research campus,Warehouse park,Car factory,Gas-fired power plant,Residential complex,d,"Tall exhaust stacks, large rectangular turbine halls and high-voltage lines radiating from a substation — the classic signature of a gas-fired power plant. The coastal location provides seawater for cooling.",26.0915,50.5935,15,https://en.wikipedia.org/wiki/Electricity_sector_in_Bahrain,QTR_Usine_electrique_26.0914721_50.5935319.jpeg,,,Centrale électrique de Bahreïn,"De hautes cheminées, de grandes salles de turbines rectangulaires et des lignes haute tension rayonnant depuis un poste de transformation — la signature classique d'une centrale au gaz. L'emplacement côtier fournit l'eau de mer pour le refroidissement.",Campus de recherche scientifique,Entrepôts,Usine automobile,Centrale électrique au gaz,Complexe résidentiel,,
26,2026,1,true,Oil sands extraction site (SAGD wells),Forest clear-cutting,Fire watchtowers,Survey markers,Oil & gas well pads,Wild reindeer enclosures,d,"The perfect grid of tiny clearings connected by access roads is the giveaway — each clearing is a well pad where steam is injected underground to extract bitumen. No open-pit mining, just an endless geometric pattern across the Canadian boreal forest.",57.0700,-111.5300,13,https://en.wikipedia.org/wiki/Oil_sands,CAN_well-pads_57.1058407_-111.0339735.jpeg,,,Site d'extraction de sables bitumineux (puits SAGD),"La grille parfaite de petites clairières reliées par des pistes est le signe distinctif — chaque clairière est une plateforme de puits. Pas d'exploitation à ciel ouvert, juste un motif géométrique infini dans la forêt boréale canadienne.",Coupe forestière,Tours de guet anti-incendie,Bornes cadastrales,Puits pétroliers et gaziers,Enclos à rennes sauvages,,
26,2026,2,false,Cattenom Nuclear Power Plant,Oil refinery tanks,Water treatment plant,Nuclear power plant,Aircraft hangar,Stadium under construction,c,"The two large circular domes are the key — these are reactor containment buildings, thick concrete shells designed to contain radioactive material. Cattenom, northeastern France, powers about 8% of the country's electricity.",49.4179,6.2211,15,https://en.wikipedia.org/wiki/Cattenom_Nuclear_Power_Plant,FRA_centrale-nucleaire_49_4178691_6_2211087.jpeg,,,Centrale nucléaire de Cattenom,"Les deux grands dômes circulaires sont le signe distinctif — ce sont des enceintes de confinement de réacteurs en béton épais. Cattenom, dans le nord-est de la France, fournit environ 8 % de l'électricité du pays.",Cuves de stockage d'une raffinerie,Station de traitement de l'eau,Centrale nucléaire,Hangar militaire,Stade en construction,,
26,2026,3,false,Bhadla Solar Park,Desert solar farm,Military camouflage nets,Fish farming pools,Drip irrigation,Greenhouse farming,a,"The vast blue-grey grid stretching across the desert is millions of solar panels. At over 56 km², Bhadla is one of the world's largest solar farms — built in one of India's hottest deserts where sun is never in short supply.",27.4851,71.9768,14,https://en.wikipedia.org/wiki/Bhadla_Solar_Park,IND_Fermes-solaires-de-Bhadla_27_4850759_71_9768130.jpeg,,,Parc solaire de Bhadla,"La vaste grille bleu-gris qui s'étend sur le désert représente des millions de panneaux solaires. Avec plus de 56 km², Bhadla est l'une des plus grandes fermes solaires au monde, construite dans l'un des déserts les plus chauds d'Inde.",Ferme solaire désertique,Filets de camouflage militaire,Bassins de pisciculture,Irrigation goutte-à-goutte,Serres maraîchères,,
